{
  "title": "Reorganize study bookshelf by color",
  "summary": "Cosmetic reminder to reorganize the bookshelf in the study by color sometime this month; explicitly no rush.",
  "actions": [
    "Reorganize study bookshelf by color this month"
  ],
  "project": "Home organization",
  "unknowns": [],
  "urgency": "low",
  "confidence": "high"
}
