{
  "title": "Neighborhood lending library box",
  "summary": "Idea to install a small book-lending library box at the end of the driveway; plans to check with the neighborhood group before building it.",
  "actions": [
    "Post in neighborhood group asking who wants to contribute books",
    "Research small lending library box designs"
  ],
  "project": "Neighborhood",
  "unknowns": [
    "Whether the neighborhood group allows structures on shared verges"
  ],
  "urgency": "low",
  "confidence": "medium"
}
