{
  "title": "Read saved-articles backlog",
  "summary": "Wants to eventually read through a backlog of saved articles, with no particular deadline, possibly over the winter.",
  "actions": [
    "Set aside time over the winter to read saved articles"
  ],
  "project": "Reading list",
  "unknowns": [],
  "urgency": "low",
  "confidence": "medium"
}
